adset,platform,headline_1,headline_2,headline_3,description_1,description_2,primary_text,headline,link_description,intro_text,description,tweet_text
1,Google,Elevate Your Data Insights,Another Elevate Your Data Insi,Buy Now,"Expert analytics architecture, with a gentle touch.",Limited time offer!,,,,,,
1,Meta,,,,,,Discover precision in analytics with our tailored architecture and debugging services.,Elevate Your Data Insights,Expert analytics solutions,,,
1,LinkedIn,,,,,,,Elevate Your Data Insights,,Looking to refine your analytics strategy? Let's collaboratively elevate your systems with precision and care.,"Expert analytics architecture, with a gentle touch.",
1,Twitter,,,,,,,,,,,"Ready to transform your data into powerful insights? 📊 We offer expert analytics architecture, auditing, and debugging with a touch of humility. #DataAnalytics #TechSolutions"
2,Google,Elevate Your Data Game,Another Elevate Your Data Game,Buy Now,"Expert analytics architecture, tailored to you.",Limited time offer!,,,,,,
2,Meta,,,,,,Discover how our analytics implementation and debugging services can refine and empower your business.,Elevate Your Data Game,Explore Our Expert Services,,,
2,LinkedIn,,,,,,,Elevate Your Data Game,,"Looking to enhance your data strategy? Our dedicated team provides expert analytics architecture, auditing, and debugging.","Expert analytics architecture, tailored to you.",
2,Twitter,,,,,,,,,,,"Need to boost your analytics capabilities? 🚀 We specialize in custom analytics architecture, plus auditing & debugging to keep you on track. Let's achieve greatness together! #DataAnalytics #Debugging #TechSolutions"
3,Google,Elevate Your Analytics,Another Elevate Your Analytics,Buy Now,Expert analytics architecture and bug fixes with a gentle touch.,Limited time offer!,,,,,,
3,Meta,,,,,,"Discover seamless analytics solutions with our expert architecture, auditing, and debugging services.",Elevate Your Analytics,Refine Your Data Strategy,,,
3,LinkedIn,,,,,,,Elevate Your Analytics,,Looking for a way to enhance your data systems? Our expert analytics services focus on delivering precision while respecting your existing frameworks.,Expert analytics architecture and bug fixes with a gentle touch.,
3,Twitter,,,,,,,,,,,"Need to upgrade your analytics without disrupting your flow? 📊 Our team offers expert architecture, auditing, and debugging, ensuring your data works for you, not against. #Analytics #DataIntegrity #TechSolutions"
4,Google,Elevate Your Data Insights,Another Elevate Your Data Insi,Buy Now,"Expert analytics architecture, auditing, and debugging.",Limited time offer!,,,,,,
4,Meta,,,,,,Unlock the full potential of your data with our expert analytics architecture and debugging services.,Elevate Your Data Insights,Explore Our Expert Services,,,
4,LinkedIn,,,,,,,Elevate Your Data Insights,,"Looking to refine your data strategies? Our expert team offers top-tier analytics architecture, auditing, and debugging.","Expert analytics architecture, auditing, and debugging.",
4,Twitter,,,,,,,,,,,"Step up your data game! 🚀 We offer specialized analytics architecture, auditing, and debugging to help you make smarter decisions. Let's dive deep into your data together. #DataAnalytics #Debugging #Auditing"
5,Google,Enhance Your Data Insights,Another Enhance Your Data Insi,Buy Now,"Expert analytics architecture, audit and fix services.",Limited time offer!,,,,,,
5,Meta,,,,,,"Let us help you refine your data strategy with expert analytics architecture, auditing, and troubleshooting.",Enhance Your Data Insights,Discover Expert Analytics Help,,,
5,LinkedIn,,,,,,,Enhance Your Data Insights,,"Seeking clarity from your data? Our humble experts specialize in analytics architecture, auditing, and debugging.","Expert analytics architecture, audit and fix services.",
5,Twitter,,,,,,,,,,,"Looking to elevate your data game? 📊 We provide expert analytics implementation, auditing, and debugging services, all while valuing your input and maintaining a humble approach. #DataAnalytics #TechSolutions"
